{"contractVersion":"1.0.0","schemaVersion":"1.0.0","source":"pagespeed","provider":"pagespeed-insights","adapterVersion":"1.1.0","status":"AVAILABLE","startedAt":"2026-08-23T03:09:48.256Z","completedAt":"2026-08-23T03:10:13.470Z","retryCount":0,"expectedRecords":2,"returnedRecords":2,"coverage":{"requested":2,"completed":2,"failed":0},"limitations":["Screenshot persistence failed for mobile: runId is required for screenshot persistence","Screenshot persistence failed for desktop: runId is required for screenshot persistence","CrUX PHONE failed (403)","CrUX DESKTOP failed (403)"],"evidence":{"sourceStatus":"AVAILABLE","source":"pagespeed-insights","intendedProvider":"pagespeed-insights","fallbackUsed":false,"mobile":{"status":"AVAILABLE","scores":{"performance":66,"accessibility":91,"bestPractices":100,"seo":73},"metrics":{"fcpMs":1839.1364940272194,"lcpMs":6962.003298736525,"cls":0.1954653465216679,"tbtMs":29.5,"speedIndexMs":1979.1652675542623,"inpMs":null}},"desktop":{"status":"AVAILABLE","scores":{"performance":94,"accessibility":92,"bestPractices":100,"seo":73},"metrics":{"fcpMs":494.8082090178395,"lcpMs":1631.635044201562,"cls":0.04118679775280899,"tbtMs":44,"speedIndexMs":571.147373178005,"inpMs":null}},"fieldData":{"phone":{"status":"FAILED","formFactor":"PHONE","metrics":null,"error":"CrUX PHONE failed (403)","dataType":"field","isLabData":false,"isFieldData":true},"desktop":{"status":"FAILED","formFactor":"DESKTOP","metrics":null,"error":"CrUX DESKTOP failed (403)","dataType":"field","isLabData":false,"isFieldData":true}},"pageResults":[],"testedUrls":[],"renderingDiagnostics":null,"collectedAt":"2026-08-23T03:10:13.470Z","coverage":{"requested":2,"completed":2,"failed":0,"usableScores":2},"limitations":["Screenshot persistence failed for mobile: runId is required for screenshot persistence","Screenshot persistence failed for desktop: runId is required for screenshot persistence","CrUX PHONE failed (403)","CrUX DESKTOP failed (403)"]},"artifact":{"key":"tenants/omnipressence/clients/rebootbusinesscoaching.com-rebootbusinesscoaching/audits/97d6b2c7-03b9-4530-8ea7-16557502c638/raw/pagespeed-b088a9bd-b517-46d8-8d6c-e9f97dd828f4.json","sha256":"2a6ad0fa501344ac8aec61b2a33f1bd850b1b85b31079be780b8536d9e702cda","bytes":926,"contentType":"application/json"}}