{"contractVersion":"1.0.0","schemaVersion":"1.0.0","source":"backlinks","provider":"DataForSEO","adapterVersion":"1.0.0","status":"AVAILABLE","startedAt":"2026-08-27T22:31:18.860Z","completedAt":"2026-08-27T22:31:21.941Z","retryCount":0,"expectedRecords":47,"returnedRecords":47,"coverage":{"requested":47,"completed":47,"failed":0},"limitations":[],"evidence":{"sourceStatus":"AVAILABLE","totalBacklinksReviewed":47,"goodCount":1,"badCount":20,"worthPursuingCount":1,"authoritySummary":{"rank":425,"backlinks":35788,"referringDomains":451,"referringPages":35540,"backlinksSpamScore":2,"targetSpamScore":null},"topGoodLinks":[{"referringDomain":"www.greencollarprogram.ca","referringPageUrl":"","targetUrl":"","anchorText":"Website Design & Digital Marketing","semanticLocation":"section","domainRank":30,"spamScore":null,"relevanceScore":18,"authorityScore":25,"placementScore":25,"spamSafetyScore":10,"backlinkQualityScore":78,"competitorOverlapCount":0,"clientHasLinkFromDomain":true,"bucket":"good","evidenceClass":"directional","classificationConfidence":0.65,"rationale":"Q=78/100 — good."}],"topBadLinks":[{"referringDomain":"aodaonline.com","referringPageUrl":"","targetUrl":"","anchorText":"The AODA Online software was proudly created by","semanticLocation":"footer","domainRank":379,"spamScore":null,"relevanceScore":8,"authorityScore":25,"placementScore":0,"spamSafetyScore":10,"backlinkQualityScore":43,"competitorOverlapCount":0,"clientHasLinkFromDomain":true,"bucket":"bad","evidenceClass":"directional","classificationConfidence":0.65,"rationale":"Q=43/100 — low-quality placement."},{"referringDomain":"www.eckler.ca","referringPageUrl":"","targetUrl":"","anchorText":"Powered by tbk Creative","semanticLocation":"footer","domainRank":232,"spamScore":null,"relevanceScore":8,"authorityScore":25,"placementScore":0,"spamSafetyScore":10,"backlinkQualityScore":43,"competitorOverlapCount":0,"clientHasLinkFromDomain":true,"bucket":"bad","evidenceClass":"directional","classificationConfidence":0.65,"rationale":"Q=43/100 — low-quality placement."},{"referringDomain":"falmouthroadrace.com","referringPageUrl":"","targetUrl":"","anchorText":"RhinoActive","semanticLocation":"footer","domainRank":465,"spamScore":null,"relevanceScore":8,"authorityScore":25,"placementScore":0,"spamSafetyScore":10,"backlinkQualityScore":43,"competitorOverlapCount":1,"clientHasLinkFromDomain":false,"bucket":"bad","evidenceClass":"directional","classificationConfidence":0.65,"rationale":"Q=43/100 — low-quality placement."},{"referringDomain":"bethanyscure.ca","referringPageUrl":"","targetUrl":"","anchorText":"RedRhino","semanticLocation":"footer","domainRank":254,"spamScore":null,"relevanceScore":8,"authorityScore":25,"placementScore":0,"spamSafetyScore":10,"backlinkQualityScore":43,"competitorOverlapCount":1,"clientHasLinkFromDomain":false,"bucket":"bad","evidenceClass":"directional","classificationConfidence":0.65,"rationale":"Q=43/100 — low-quality placement."},{"referringDomain":"alcotex.com","referringPageUrl":"","targetUrl":"","anchorText":"RedRhino & RhinoActive","semanticLocation":"footer","domainRank":181,"spamScore":null,"relevanceScore":8,"authorityScore":25,"placementScore":0,"spamSafetyScore":10,"backlinkQualityScore":43,"competitorOverlapCount":1,"clientHasLinkFromDomain":false,"bucket":"bad","evidenceClass":"directional","classificationConfidence":0.65,"rationale":"Q=43/100 — low-quality placement."},{"referringDomain":"suntasticfresh.com","referringPageUrl":"","targetUrl":"","anchorText":"RedRhino &nbsp&","semanticLocation":"footer","domainRank":183,"spamScore":null,"relevanceScore":8,"authorityScore":25,"placementScore":0,"spamSafetyScore":10,"backlinkQualityScore":43,"competitorOverlapCount":1,"clientHasLinkFromDomain":false,"bucket":"bad","evidenceClass":"directional","classificationConfidence":0.65,"rationale":"Q=43/100 — low-quality placement."},{"referringDomain":"www.mkrittenhouse.com","referringPageUrl":"","targetUrl":"","anchorText":"Northern","semanticLocation":"footer","domainRank":203,"spamScore":null,"relevanceScore":8,"authorityScore":25,"placementScore":0,"spamSafetyScore":10,"backlinkQualityScore":43,"competitorOverlapCount":1,"clientHasLinkFromDomain":false,"bucket":"bad","evidenceClass":"directional","classificationConfidence":0.65,"rationale":"Q=43/100 — low-quality placement."},{"referringDomain":"chatters.ca","referringPageUrl":"","targetUrl":"","anchorText":"northern.co","semanticLocation":"footer","domainRank":330,"spamScore":null,"relevanceScore":8,"authorityScore":25,"placementScore":0,"spamSafetyScore":10,"backlinkQualityScore":43,"competitorOverlapCount":1,"clientHasLinkFromDomain":false,"bucket":"bad","evidenceClass":"directional","classificationConfidence":0.65,"rationale":"Q=43/100 — low-quality placement."},{"referringDomain":"gardenoflifecanada.com","referringPageUrl":"","targetUrl":"","anchorText":"Empowering extraordinary health","semanticLocation":"footer","domainRank":267,"spamScore":null,"relevanceScore":8,"authorityScore":25,"placementScore":0,"spamSafetyScore":10,"backlinkQualityScore":43,"competitorOverlapCount":1,"clientHasLinkFromDomain":false,"bucket":"bad","evidenceClass":"directional","classificationConfidence":0.65,"rationale":"Q=43/100 — low-quality placement."},{"referringDomain":"www.masterfeeds.com","referringPageUrl":"","targetUrl":"","anchorText":"Northern.co","semanticLocation":"footer","domainRank":300,"spamScore":null,"relevanceScore":8,"authorityScore":25,"placementScore":0,"spamSafetyScore":10,"backlinkQualityScore":43,"competitorOverlapCount":1,"clientHasLinkFromDomain":false,"bucket":"bad","evidenceClass":"directional","classificationConfidence":0.65,"rationale":"Q=43/100 — low-quality placement."}],"topWorthPursuingDomains":[{"referringDomain":"agencylist.com","referringPageUrl":"","targetUrl":"","anchorText":"Visit red-rhino.com","semanticLocation":"section","domainRank":277,"spamScore":null,"relevanceScore":18,"authorityScore":25,"placementScore":25,"spamSafetyScore":10,"backlinkQualityScore":78,"competitorOverlapCount":2,"clientHasLinkFromDomain":false,"bucket":"worth_pursuing","evidenceClass":"supported","classificationConfidence":0.75,"rationale":"Q=78/100 — worth pursuing."}],"backlinks":[],"collectedAt":"2026-08-27T22:31:21.941Z","coverage":{"requested":47,"completed":47,"failed":0},"limitations":[]},"artifact":{"key":"tenants/omnipressence/clients/www.tbkcreative.com-tbkcreative/audits/9714c206-8ed3-4686-8fe2-ceeca0ca0f82/raw/backlinks-b40b829a-9770-43bb-bb5b-755b53947698.json","sha256":"40c14248c0e7cd3aea0f6ad070d029e7daa42c050197f402ed50528eafa7ee44","bytes":1273,"contentType":"application/json"}}