{"contractVersion":"1.0.0","schemaVersion":"1.0.0","source":"backlinks","provider":"DataForSEO","adapterVersion":"1.0.0","status":"AVAILABLE","startedAt":"2026-08-23T03:13:20.490Z","completedAt":"2026-08-23T03:13:22.041Z","retryCount":0,"expectedRecords":66,"returnedRecords":66,"coverage":{"requested":66,"completed":66,"failed":0},"limitations":[],"evidence":{"sourceStatus":"AVAILABLE","totalBacklinksReviewed":66,"goodCount":0,"badCount":5,"worthPursuingCount":0,"authoritySummary":{"rank":0,"backlinks":30,"referringDomains":29,"referringPages":30,"backlinksSpamScore":52,"targetSpamScore":null},"topGoodLinks":[],"topBadLinks":[{"referringDomain":"www.refinedeventrentals.com","referringPageUrl":"","targetUrl":"","anchorText":"Tracey Jazmin","semanticLocation":"footer","domainRank":34,"spamScore":null,"relevanceScore":8,"authorityScore":25,"placementScore":0,"spamSafetyScore":10,"backlinkQualityScore":43,"competitorOverlapCount":1,"clientHasLinkFromDomain":false,"bucket":"bad","evidenceClass":"directional","classificationConfidence":0.65,"rationale":"Q=43/100 — low-quality placement."},{"referringDomain":"www.bellacasadayspa.com","referringPageUrl":"","targetUrl":"","anchorText":"Tracey Jaszmin","semanticLocation":"footer","domainRank":90,"spamScore":null,"relevanceScore":8,"authorityScore":25,"placementScore":0,"spamSafetyScore":10,"backlinkQualityScore":43,"competitorOverlapCount":1,"clientHasLinkFromDomain":false,"bucket":"bad","evidenceClass":"directional","classificationConfidence":0.65,"rationale":"Q=43/100 — low-quality placement."},{"referringDomain":"theforbestimes.com","referringPageUrl":"","targetUrl":"","anchorText":"High Quality Dofollow Backlinks DA 50 PA 40 Premium PBN Network Service rebootbusinesscoaching.com Rank First Page Google Fast SEO Link Building Buy Backlinks Online Cheap","semanticLocation":"unknown","domainRank":216,"spamScore":null,"relevanceScore":8,"authorityScore":25,"placementScore":15,"spamSafetyScore":10,"backlinkQualityScore":58,"competitorOverlapCount":1,"clientHasLinkFromDomain":true,"bucket":"bad","evidenceClass":"directional","classificationConfidence":0.6,"rationale":"Q=58/100 — spammy anchor text."},{"referringDomain":"m98ufa.com","referringPageUrl":"","targetUrl":"","anchorText":"High Quality Dofollow Backlinks DA 50 PA 40 Premium PBN Network Service ginakeeping.ca Rank First Page Google Fast SEO Link Building Buy Backlinks Online Cheap","semanticLocation":"unknown","domainRank":265,"spamScore":null,"relevanceScore":8,"authorityScore":25,"placementScore":15,"spamSafetyScore":10,"backlinkQualityScore":58,"competitorOverlapCount":1,"clientHasLinkFromDomain":false,"bucket":"bad","evidenceClass":"directional","classificationConfidence":0.6,"rationale":"Q=58/100 — spammy anchor text."},{"referringDomain":"hostprinter.com","referringPageUrl":"","targetUrl":"","anchorText":"High Quality Dofollow Backlinks DA 50 PA 40 Premium PBN Network Service clarityofgoalsandvision.com Rank First Page Google Fast SEO Link Building Buy Backlinks Online Cheap","semanticLocation":"unknown","domainRank":99,"spamScore":null,"relevanceScore":8,"authorityScore":25,"placementScore":15,"spamSafetyScore":10,"backlinkQualityScore":58,"competitorOverlapCount":1,"clientHasLinkFromDomain":false,"bucket":"bad","evidenceClass":"directional","classificationConfidence":0.6,"rationale":"Q=58/100 — spammy anchor text."}],"topWorthPursuingDomains":[],"backlinks":[],"collectedAt":"2026-08-23T03:13:22.041Z","coverage":{"requested":66,"completed":66,"failed":0},"limitations":[]},"artifact":{"key":"tenants/omnipressence/clients/rebootbusinesscoaching.com-rebootbusinesscoaching/audits/97d6b2c7-03b9-4530-8ea7-16557502c638/raw/backlinks-b088a9bd-b517-46d8-8d6c-e9f97dd828f4.json","sha256":"01bde8d7d2438c867de7bda5dc5a3a81a62d025d08ba42d8847e428b112fd71b","bytes":326,"contentType":"application/json"}}