{"contractVersion":"1.0.0","schemaVersion":"1.0.0","source":"dataforseo-serp","provider":"mock","adapterVersion":"1.1.0","status":"FAILED","startedAt":"2026-08-23T03:13:20.061Z","completedAt":"2026-08-23T03:13:20.061Z","retryCount":2,"expectedRecords":0,"returnedRecords":0,"coverage":{"requested":0,"completed":0,"failed":0},"limitations":["Source execution failed: Source execution timed out"],"evidence":{},"errorCategory":"timeout"}